"category","feature","which_competitors_have_it","why_it_matters","suggested_implementation","estimated_effort","priority","source_urls"
"H. System integration","OSC / MIDI control surface","Bitfocus Companion, third-party Stream Deck MIDI plugins","Audio engineers and lighting techs run on OSC and MIDI; supporting them turns AKP05 (touch strip + dials) into a real production controller.","Add `osc_transport.cpp` (oscpack) and `midi_transport.cpp` (RtMidi) under `src/plugins`. Map to the same Action API.","M","P1","[Companion OSC/MIDI](https://bitfocus.io/companion)"
"H. System integration","OBS Studio plugin (scenes, sources, recording)","Stream Deck (OBS plugin), StreamController, Companion","OBS is the most-installed Stream Deck plugin. Day-1 absence is highly visible.","Ship `python/ajazz_plugins/obs/` using `obsws-python` (obs-websocket 5.x). No core changes.","S","P0","[Stream Deck OBS plugin](https://www.elgato.com/us/en/explorer/products/stream-deck/stream-deck-plugins-for-streaming/); [StreamController OBS](https://flathub.org/en/apps/com.core447.StreamController)"
"H. System integration","Spotify / media-control plugin","Stream Deck (Spotify plugin), StreamController (control your music)","Pause / skip / volume on physical keys is the most common 'aha' moment for new users.","Ship `python/ajazz_plugins/media/` using MPRIS on Linux, SMTC on Windows, MediaRemote on macOS.","S","P0","[Stream Deck Spotify plugin](https://www.elgato.com/us/en/explorer/products/stream-deck/stream-deck-plugins-for-streaming/)"
"H. System integration","Twitch / Discord plugins","Stream Deck (Twitch, Discord plugins), Companion","Streamers expect chat mode toggles, ad break triggers, push-to-talk on a key. Hits the streaming demographic squarely.","Ship Python plugins using twitchAPI and Discord IPC; `python/ajazz_plugins/twitch/` and `discord/`.","M","P1","[Stream Deck Twitch plugin](https://www.elgato.com/us/en/explorer/products/stream-deck/stream-deck-plugins-for-streaming/)"
"H. System integration","Home Assistant / Philips Hue / smart-home plugin","Stream Deck (Philips Hue, API Ninja for HA), iCUE Murals (Hue/Nanoleaf), Companion","Home automation crowd is huge and underserved on Linux. A Home Assistant REST plugin is a few hours of work.","Ship `python/ajazz_plugins/homeassistant/` calling the HA REST API; ship `philips_hue/` using `phue` library.","S","P1","[iCUE Murals Hue/Nanoleaf](https://www.corsair.com/us/en/s/icue-murals-lighting); [Stream Deck Hue plugin](https://www.youtube.com/watch?v=8Qelv1qTuSg)"
"H. System integration","Autostart on login (cross-platform)","All competitors (iCUE, Synapse, G HUB, Armoury Crate, Stream Deck)","Hardware-control daemons must run from boot to be useful — a profile that doesn't auto-load is not a profile.","Add a `StartupRegistrar` in `src/app` writing to `~/.config/autostart/*.desktop` (XDG), `HKCU\...\Run` (Windows), and `~/Library/LaunchAgents/*.plist` (macOS).","S","P0","[Stream Deck behaviour](https://help.elgato.com/hc/en-us/articles/360053419071-Elgato-Stream-Deck-Smart-Profiles)"
"H. System integration","OS notifications (firmware available, device connected, battery low)","iCUE (toast notifications), Synapse, G HUB","Without notifications, users miss firmware updates and battery warnings.","Add a `NotificationService` in `src/app` using QSystemTrayIcon + libnotify / NSUserNotificationCenter / Windows Toast.","S","P1","[iCUE notifications](https://www.corsair.com/us/en/explorer/gamer/accessories/how-to-update-icue-step-by-step-guide/)"
"I. Telemetry / firmware / health","In-app firmware update flow with rollback","Corsair iCUE, Razer Synapse 4, Logitech G HUB, ASUS Armoury Crate","Without a firmware UI, fixing protocol bugs forces the user to use the OEM Windows tool — which contradicts the project's value proposition.","Add a `FirmwareUpdater` module per device family in `src/devices/*/firmware.cpp`; CDN-hosted signed manifest checked at startup. Reuse `hid_transport` for delivery.","L","P1","[iCUE firmware update](https://help.corsair.com/hc/en-us/articles/30111455660173-Audio-How-to-Update-your-headset-s-firmware); [Synapse firmware](https://insider.razer.com/razer-support-45/update-issue-0-battery-53786)"
"I. Telemetry / firmware / health","Battery indicator for wireless mice (percentage in tray + UI)","Razer Synapse, Logitech G HUB / Options+, Corsair iCUE","AJ339/AJ380 are wireless variants per the device table; users will look for a tray battery icon first.","Add `battery()` to `mouse.hpp` capability set; poll in `aj_series.cpp` and surface in `tray_controller.cpp`.","S","P1","[Razer battery percentage](https://insider.razer.com/razer-synapse-4-55/razer-synapse-4-not-displaying-battery-percentage-77087); [Logitech battery](https://hub.sync.logitech.com/mx-master-3s/post/how-do-i-check-the-battery-level-on-my-mice-and-keyboard-WkcnD9dnohFqEyM)"
"I. Telemetry / firmware / health","Polling-rate / latency monitor (live graph)","Razer Synapse (latency lab style), Logitech G HUB","Power users want proof their 4 kHz mouse is actually polling at 4 kHz. A simple latency widget builds trust.","Add a `LatencyProbe` in `src/core` measuring HID report intervals; render a sparkline in a new diagnostics panel in `DeviceList.qml`.","M","P2","[G HUB 4K polling discussion](https://www.reddit.com/r/MouseReview/comments/1ban9b8/do_you_need_g_hub_to_be_open_to_use_4k_polling/)"
"I. Telemetry / firmware / health","Cloud / encrypted local backup of profiles","Razer Synapse 4 cloud, G HUB cloud, Vial JSON files","After investing hours into a layout, losing it to disk failure is unacceptable. A nightly local backup directory is one screen of code.","Add a `BackupService` in `src/core` snapshotting `~/.config/ajazz/profiles` to a rotating zip every N hours; expose Restore in the UI.","S","P2","[Synapse cloud sync](https://mysupport.razer.com/app/answers/detail/a_id/13859/~/how-to-sync-razer-synapse-profiles-across-multiple-pcs)"
"J. UX polish","First-run onboarding wizard (detects devices, suggests profiles)","Razer Synapse 4, Stream Deck (welcome flow), iCUE","The first 60 seconds determine whether the user sticks with the project. Today the QML root is `Main.qml` -> `DeviceList.qml` with no greeter.","Add `Onboarding.qml` shown on first launch (no `~/.config/ajazz/state.json`); guides through device detection, suggests a starter profile from the catalog.","M","P1","(Inferred from competitor UX flows; no single citation needed)"
"J. UX polish","Localization / i18n (at least: EN, DE, FR, ES, ZH-CN, JA)","All major vendors localize; AJAZZ users include mainland China and Japan","AJAZZ is a Chinese brand and Mirabox sells globally. Anglophone-only locks out a large share of users.","Wrap all QML strings in `qsTr()` and add Qt Linguist `.ts` files under `resources/i18n/`. Wire `QTranslator` install in `application.cpp`.","M","P1","(Inferred from product positioning)"
"J. UX polish","Light/dark theme switcher","Razer Synapse 4, iCUE, G HUB, Armoury Crate","Tiny ergonomic win that signals product polish and respects OS appearance settings.","Add a `ThemeManager` in `src/app/branding_service.cpp` listening to QPalette changes and exposing a manual override; wire to `Main.qml` Style component.","S","P2","(Inferred from product UI screenshots)"
"J. UX polish","In-app changelog and release notes viewer","Razer Synapse 4, iCUE","Power users want to know what changed when an update lands. Reading from `CHANGELOG.md` (already in repo) is trivial.","Add a `ChangelogViewer.qml` rendering `CHANGELOG.md` (already present) via `QQuickWebEngineView` or a Markdown-to-HTML pass.","S","P2","(Inferred)"
"J. UX polish","Tooltips, contextual help and keyboard shortcuts","All major vendors","Discoverability of advanced features (keymap layers, conditional actions) collapses without inline help.","Add a `Hint` attached property used across QML; bind to `?` and `F1` keys. Document in CONTRIBUTING.","S","P2","(Inferred)"
"J. UX polish","Accessibility (screen-reader labels, high-contrast mode, keyboard nav)","All major vendors at minimum tab-navigable; few are screen-reader complete.","Differentiator: open-source projects can be best-in-class on accessibility. WCAG basics are GPL-3 friendly.","Set `Accessible.role` and `Accessible.name` on QML components; ensure focus order in `Main.qml`. Test with Orca / NVDA / VoiceOver.","M","P2","(Inferred)"
"K. Security / privacy","Code-signed installers and notarized macOS DMG","All major vendors (Razer, Corsair, Logitech, ASUS)","Without code signing, Windows SmartScreen blocks the .msi and macOS Gatekeeper blocks the DMG; users will not paste shell commands to bypass them.","Use sigstore + Apple `notarytool` in `.github/workflows/release.yml`; wire Authenticode signing for the .msi (Trusted Signing) and `productsign` for .dmg.","M","P0","[Release workflow location](https://github.com/Aiacos/ajazz-control-center/blob/main/.github/workflows/release.yml)"
"K. Security / privacy","Signed plugin packages (verify before load)","Stream Deck SDK (manifests + warnings), Razer Synapse modules","A signed `.ajazzplugin` archive prevents trojaned community plugins from running with full Python privileges.","Sign plugin packages with maintainer Ed25519 keys; verify in `plugin_host.cpp` before `import`. Display unsigned warning sheet.","M","P1","[Stream Deck plugin secrets guidance](https://docs.elgato.com/streamdeck/sdk/introduction/plugin-environment/)"
"K. Security / privacy","Signed firmware verification (refuse unsigned blobs)","Razer, Corsair (sign vendor firmware)","Pushing arbitrary firmware blobs over HID is a brick risk and a supply-chain vector. Require a manifest signature before flashing.","Add a `verify_firmware()` step in the firmware updater; reject if SHA-256 + Ed25519 sig don't match the public key compiled in.","M","P1","(Inferred industry standard)"
"K. Security / privacy","Documented data retention / privacy policy (no telemetry by default)","OpenRGB (no telemetry); contrast: Razer/Corsair require accounts and collect telemetry","Privacy-first defaults are a real selling point versus iCUE/Synapse account requirements. Codify in SECURITY.md.","Add `docs/PRIVACY.md` documenting that the app makes zero outbound calls except optional update check; gate the check behind a settings toggle in `application.cpp`.","S","P1","[OpenRGB philosophy](https://openrgb.org)"
"K. Security / privacy","Reproducible builds (verifiable nightly artifacts)","OpenRGB community efforts; debian/Flathub guidance","Reproducible builds let users verify that the released `.deb`/`.rpm` matches the public source — high-trust differentiator vs proprietary stack.","Pin toolchain versions in CMakePresets, set `SOURCE_DATE_EPOCH`, and document `diffoscope`-based verification in `docs/wiki/Release-Process.md`.","L","P2","(Inferred from industry practice)"
"K. Security / privacy","GDPR / data-export and account deletion (if any cloud sync is added)","Razer, Corsair, Logitech (account-bound)","If cloud sync (C) is ever offered, GDPR Articles 15/17 require export and deletion endpoints. Easier to design in than retrofit.","If a cloud sync provider is implemented, ship `Settings -> Privacy -> Export my data / Delete account` flows in QML and document the schema.","S","P2","(Inferred regulatory requirement)"
