"category","feature","which_competitors_have_it","why_it_matters","suggested_implementation","estimated_effort","priority","source_urls"
"A. Macro / action engine","Multi-action bundles (chained actions on one key with per-step delays)","Elgato Stream Deck, Corsair iCUE, Bitfocus Companion","Lets a user trigger a sequence (launch app, mute mic, switch scene) from a single key — the canonical Stream Deck workflow. Without it the AKP devices are reduced to single-shortcut keys.","Add an `Action` interface in `src/core` (think `core/action.hpp`) plus a `MultiAction` composite executed by an `ActionRunner` thread. Wire into `profile.hpp` so a key/encoder slot stores a list of actions instead of a single keystroke. Surface in `src/app/qml/KeyDesigner.qml` as a drag-and-drop list.","L","P0","[Stream Deck Multi-Actions](https://help.elgato.com/hc/en-us/articles/360027960912-Elgato-Stream-Deck-Multi-Actions); [Bitfocus Companion stacked actions](https://bitfocus.io/companion)"
"A. Macro / action engine","Conditional / branching actions (if-state, toggle, latch)","Bitfocus Companion, Razer Synapse Hypershift, Elgato Key Logic (single/double/long press)","Modern macro pads need state-aware buttons — e.g. a key that pulses red while OBS is recording and toggles between start/stop. Without conditions the device cannot reflect external state.","Extend the `Action` interface with a `condition` predicate and an `ActionState` cache in `core/event_bus`. Add feedback bindings so plugins can push state back to the UI.","L","P1","[Stream Deck Key Logic (single/double/hold)](https://www.elgato.com/us/en/p/stream-deck-plus); [Razer Hypershift](https://mysupport.razer.com/app/answers/detail/a_id/1789/~/how-to-activate-the-razer-hypershift-on-a-razer-mouse); [Companion feedback](https://bitfocus.io/companion)"
"A. Macro / action engine","Variables, counters, and on-screen state for keys","Bitfocus Companion, Stream Deck (counter actions, dynamic titles)","Counters (kill count, scene number, timer) and dynamic titles make a Stream Deck genuinely useful for streaming/broadcast. ajazz-control-center has only static profile data.","Add a `VariableStore` to `src/core` with publish/subscribe semantics; expose `setTitle/setImage` from plugin host so Python plugins can push state changes to a key.","M","P1","[Companion button feedback](https://bitfocus.io/companion); [Stream Deck SDK setTitle/setImage](https://docs.elgato.com/streamdeck/sdk/introduction/plugin-environment/)"
"A. Macro / action engine","System-event triggers (timer, hotkey, app focus, file change)","iCUE (timer action), Stream Deck Smart Profiles, Companion (TCP/HTTP/OSC triggers)","Triggers turn the device from a passive grid into an automation surface — flash a key when a download finishes, switch profile when Discord opens.","Introduce a `TriggerSource` interface in `src/core` plus per-platform watchers (DBus on Linux, NSWorkspace on macOS, `WinEventHook` on Windows) feeding the same `event_bus`.","L","P1","[iCUE timer action](https://www.youtube.com/watch?v=T5WzjbfbGk0); [Smart Profiles](https://help.elgato.com/hc/en-us/articles/360053419071-Elgato-Stream-Deck-Smart-Profiles)"
"A. Macro / action engine","Macro recorder (capture keystrokes/mouse with timing, edit afterwards)","Corsair iCUE, Razer Synapse 4, Logitech G HUB, ASUS Armoury Crate, Vial","On-the-fly macro recording with editable timing is table-stakes on every gaming peripheral. Power users won't switch from vendor software without it.","Add a `MacroRecorder` in `src/core` using libinput/`uiohook`/native event taps; render the editable timeline in `src/app/qml/ProfileEditor.qml`. Persist into existing macro slots in keyboard backend.","M","P0","[iCUE macro recorder](https://www.corsair.com/us/en/explorer/gamer/keyboards/how-to-add-macros-and-remap-keys-in-corsair-icue/); [Vial macros](https://x-bows.com/blogs/engineering-innovation/definitive-guide-qmk-via-vial-xbows-keyboards); [Synapse macros](https://www.razer.com/synapse-4)"
"A. Macro / action engine","Tap / hold / double-press dual-function keys","Vial (tap dance), Stream Deck Key Logic, QMK/VIA","Lets one physical key do two or three things — essential for compact AKP03 (6 keys) layouts and for keyboard layer modifiers.","Implement a `TapHoldAction` decorator in `src/core` with timeout and tap-count parameters. For VIA-flashed boards, expose tap-dance settings to `src/devices/keyboard/via_keyboard.cpp`.","M","P1","[Vial tap-dance](https://x-bows.com/blogs/engineering-innovation/definitive-guide-qmk-via-vial-xbows-keyboards); [Stream Deck Key Logic](https://www.elgato.com/us/en/p/stream-deck-plus)"
"B. Plugin / extensibility ecosystem","Public plugin marketplace / store (browse, install, update from inside the app)","Elgato Stream Deck (Marketplace), Razer Synapse (Modules), StreamController (built-in store)","Discoverability is the single biggest reason Stream Deck dominates — users get OBS/Twitch/Spotify/Hue plugins with two clicks. A repo-driven catalog feels equally low-effort to install.","Add a `PluginStoreClient` in `src/plugins` that pulls a signed JSON manifest list from a community Git repo; surface in a new `PluginStore.qml`. Store metadata schema mirrors Stream Deck's manifest.json.","L","P0","[Stream Deck Marketplace plugins](https://www.elgato.com/us/en/explorer/products/stream-deck/how-to-make-your-own-stream-deck-plugin/); [StreamController built-in store](https://flathub.org/en/apps/com.core447.StreamController)"
"B. Plugin / extensibility ecosystem","WebSocket-based plugin protocol (language-agnostic; JS/C#/C++/Rust plugins)","Elgato Stream Deck SDK (Node.js + WebSocket native plugins)","A WebSocket protocol decouples plugin runtime from the host; today, ajazz only supports embedded Python which excludes JavaScript and Rust authors and complicates sandboxing.","Add a `PluginGateway` WebSocket server in `src/plugins/src/plugin_host.cpp` exposing the same event/command surface as the embedded Python API; document a Stream-Deck-compatible JSON message schema.","L","P1","[Stream Deck plugin environment & WebSocket](https://docs.elgato.com/streamdeck/sdk/introduction/plugin-environment/)"
"B. Plugin / extensibility ecosystem","Hot-reload of plugins without restarting the app","Elgato Stream Deck (per-plugin restart), G HUB Lua (Save & Run)","Drastically improves plugin developer experience and lets users toggle plugins without losing their session.","Add a file-watcher in `src/plugins/src/plugin_host.cpp` keyed off mtime of `python/ajazz_plugins/*` and re-import via importlib; expose Reload action in the QML plugin manager.","S","P2","[G HUB Lua Save & Run](https://www.youtube.com/watch?v=B90-c33lb1U)"
"B. Plugin / extensibility ecosystem","Property Inspector UI for plugins (HTML/QML form auto-rendered next to the action)","Elgato Stream Deck (Property Inspector with Chromium/DOM)","Plugin authors need a way to expose configuration without writing native QML. Without it every plugin must ship its own ad-hoc settings page.","Define a JSON-Schema-based property descriptor in `src/plugins/include/ajazz/plugins`; auto-render to QML form fields in `src/app/qml/KeyDesigner.qml`.","M","P1","[Property Inspector spec](https://docs.elgato.com/streamdeck/sdk/introduction/plugin-environment/)"
"B. Plugin / extensibility ecosystem","Plugin sandboxing (resource limits, FS/network allow-list, signing)","Stream Deck (recommended secrets handling, per-plugin process), Razer Synapse modules","Embedding a Python interpreter as `python_bindings.cpp` does today gives plugins the entire host's privileges — a serious supply-chain risk for a community catalog.","Run each Python plugin in a subprocess via `multiprocessing` over IPC; gate filesystem and network with a manifest-declared permission list parsed in `plugin_host.cpp`. Verify Ed25519 signatures on package install.","L","P1","[Stream Deck SDK security guidance](https://docs.elgato.com/streamdeck/sdk/introduction/plugin-environment/)"
"C. Profile management","Auto-switch profile when a specific app is in focus","Elgato Smart Profiles, Corsair iCUE, ASUS Armoury Crate (Scenario Profiles), Razer Synapse 4, Logitech G HUB, StreamController","Every competitor does this — the user expects the AKP05 to load OBS keys when OBS is open and a coding layout when VS Code is open. Without it, profiles are manual-only.","Add a `FocusWatcher` in `src/app` (Win32 GetForegroundWindow / NSWorkspace activeApplication / EWMH _NET_ACTIVE_WINDOW + Wayland ext-foreign-toplevel) and bind to `profile_controller.cpp`.","M","P0","[Smart Profiles](https://help.elgato.com/hc/en-us/articles/360053419071-Elgato-Stream-Deck-Smart-Profiles); [iCUE per-game profiles](https://www.corsair.com/us/en/explorer/diy-builder/how-tos/how-to-create-an-icue-profile-for-your-favorite-game/); [Armoury Crate Scenario Profiles](https://rog.asus.com/articles/guides/guide-scenario-profiles-make-games-and-apps-run-with-your-preferred-system-settings-every-time/); [G HUB profiles](https://www.youtube.com/watch?v=nLN5VWtvds4); [StreamController auto page switch](https://flathub.org/en/apps/com.core447.StreamController)"
"C. Profile management","Per-window-title rules (regex match, not just executable)","Bitfocus Companion (regex triggers), Stream Deck via plugins","Some users want different layouts inside the same app (e.g. Photoshop tool palettes per document type). Title-based rules unlock that without writing plugins.","Extend the `FocusWatcher` rule schema in `profile.hpp` to accept `match_executable` AND `match_title_regex`; evaluate both before activating a profile.","S","P2","[Companion triggers](https://bitfocus.io/companion)"
"C. Profile management","Profile import / export to a single shareable file","Stream Deck (.streamDeckProfile), Razer Synapse, iCUE, G HUB, Vial (.vil)","Sharing setups with friends or moving to a new PC is impossible without round-trip serialization. Already partially modelled by `docs/protocols/PROFILE_SCHEMA.md` — needs UI.","Wire `profile_controller.cpp` to (de)serialize a tarball of `profile.json` + key images + macros; expose Import/Export buttons in `ProfileEditor.qml`. Add zip dependency to CMake.","S","P0","[Vial .vil files](https://x-bows.com/blogs/engineering-innovation/definitive-guide-qmk-via-vial-xbows-keyboards); [Stream Deck profiles](https://www.elgato.com/us/en/explorer/products/stream-deck/how-to-use-folders-stream-deck/)"
"C. Profile management","Cloud sync of profiles across multiple PCs","Razer Synapse 4 (Razer ID), Logitech G HUB (account)","For users with desk + laptop, cloud sync prevents drift. A privacy-respecting opt-in (Git, Nextcloud, custom S3) fits the GPL-3 ethos.","Add a `SyncProvider` interface in `src/core` with pluggable backends (local Git remote, WebDAV, S3). Avoid a vendor-locked default — let the user point at their own remote.","L","P2","[Razer Synapse 4 cloud sync](https://mysupport.razer.com/app/answers/detail/a_id/13859/~/how-to-sync-razer-synapse-profiles-across-multiple-pcs)"
"C. Profile management","Community profile sharing (browse / download premade layouts)","Stream Deck Marketplace, Vial public layouts repo","Lowers onboarding to ~30 seconds for new users — they pick the 'YouTube editing' or 'Blender' profile and start working.","Re-use the `PluginStoreClient` infrastructure (B) for a `ProfileCatalog` indexing a community repo of `*.profile.zip` files. Auto-validate against the existing JSON schema.","M","P1","[Stream Deck Marketplace profiles](https://help.elgato.com/hc/en-us/articles/360053419071-Elgato-Stream-Deck-Smart-Profiles)"
"C. Profile management","Profile groups / linked profiles (multiple devices change at once)","Stream Deck (linked profiles across multiple decks)","A user with an AKP153 next to an AKP05 expects both to switch when they open OBS. Today profiles are per-device.","Add a `ProfileGroup` aggregate in `profile.hpp` that maps device IDs to per-device profile IDs; `profile_controller` activates them as a transaction.","M","P2","[Linked profiles tutorial](https://www.youtube.com/watch?v=hLTPj9rECCI)"
"D. RGB / lighting","Layered effects with timeline editor (à la Aura Creator)","ASUS Aura Creator, Razer Chroma Studio, Corsair iCUE","Power users design multi-layer effects (base wave + reactive overlay + game integration) with video-editor-style timelines. ajazz currently only has an `RgbPicker.qml`.","Add an `EffectGraph` model in `src/core` (layers, blend modes, durations); render in a new `EffectEditor.qml`. Per-key composition stays in the device backend.","L","P1","[Aura Creator](https://www.asus.com/support/faq/1040569/); [iCUE Murals layered lighting](https://www.corsair.com/us/en/s/icue-murals-lighting); [Chroma Studio](https://www.upgrade-my-laptop.com/guides/laptop-support/razer-chroma-explained-a-deep-dive-into-rgb-profiles-studio-connect-visualizer/)"
"D. RGB / lighting","Audio-reactive lighting (mic / output spectrum)","Razer Chroma Visualizer, Corsair iCUE Murals (Dynamic Audio EQ), Aura Creator (Sync with Music), OpenRGB Keyboard Visualizer","A staple effect users expect from any RGB software in 2026; audio-reactive backlights are highly demoable and highly social.","Add an `AudioCaptureSource` plugin in `src/plugins` (PortAudio / WASAPI loopback / PulseAudio monitor); feed FFT bins into the `EffectGraph` as a layer.","M","P1","[Chroma Visualizer](https://www.upgrade-my-laptop.com/guides/laptop-support/razer-chroma-explained-a-deep-dive-into-rgb-profiles-studio-connect-visualizer/); [iCUE Murals dynamic audio EQ](https://www.corsair.com/us/en/s/icue-murals-lighting); [Aura Creator Sync with Music](https://www.asus.com/us/support/faq/1042503/)"
"D. RGB / lighting","Screen-reactive / ambient lighting (sample regions of the desktop)","ASUS Aura Creator (Adaptive Color), Corsair iCUE Murals (Monitor Screen), OpenRGB SDK + ambient apps","Turns the keyboard/mouse into an extension of the monitor — a marquee feature for both productivity and gaming.","Add a `ScreenSampler` capturing the framebuffer (DXGI desktop dup / ScreenCaptureKit / Pipewire / X11 XSHM); average configurable regions and feed into `EffectGraph`.","M","P1","[Aura Adaptive Color](https://www.asus.com/us/support/faq/1042503/); [iCUE Murals Monitor Screen](https://www.corsair.com/us/en/s/icue-murals-lighting)"
"D. RGB / lighting","Multi-device sync across vendors (AURA Sync / iCUE / OpenRGB ecosystem)","ASUS Aura Sync, Corsair iCUE (third-party motherboards, Philips Hue, Nanoleaf, Govee), OpenRGB (cross-vendor SDK)","Users own RGB from many vendors; the project wins more friends if it can publish to and consume from the OpenRGB SDK rather than be yet another silo.","Add an `OpenRGBClient` and `OpenRGBServer` module in `src/plugins` exposing devices on the OpenRGB SDK port (6742) so any third-party effect tool can drive AJAZZ devices and vice versa.","M","P1","[OpenRGB SDK](https://openrgb.org); [iCUE third-party RGB](https://www.corsair.com/us/en/s/icue); [Aura Sync](https://rog.asus.com/us/articles/guides/how-to-customize-your-pcs-rgb-lighting-with-aura-sync/)"
"D. RGB / lighting","Per-game / per-app static lighting profiles","Corsair iCUE, Razer Chroma Connect, Logitech LIGHTSYNC, ASUS Scenario Profiles","Highlight WASD red in shooters, function row blue in DAWs — basic but expected. Comes for free once profile auto-switching (C) is in.","Once `FocusWatcher` lands, ensure RGB layer state is part of the profile activated by `profile_controller`; no separate work in device backend.","S","P0","[iCUE per-game profiles](https://www.corsair.com/us/en/explorer/diy-builder/how-tos/how-to-create-an-icue-profile-for-your-favorite-game/); [LIGHTSYNC profiles](https://www.youtube.com/watch?v=nLN5VWtvds4)"
"D. RGB / lighting","Game integrations (telemetry-driven lighting for low health, cooldowns, ammo)","Razer Chroma Connect (game SDK), Logitech LIGHTSYNC, Corsair iCUE SDK","Long tail of game-specific lighting (e.g. Apex Legends ammo, Discord notifications) is a major draw for the gaming demographic.","Re-export the lighting buffer over the OpenRGB SDK (already proposed) plus a Razer-Chroma-compatible REST shim — many games already publish to it.","L","P2","[Chroma Connect](https://www.upgrade-my-laptop.com/guides/laptop-support/razer-chroma-explained-a-deep-dive-into-rgb-profiles-studio-connect-visualizer/)"
"E. Stream Deck specific","Folders / nested folders (one key opens a child layout)","Elgato Stream Deck (folders, sub-folders, auto-exit), StreamController (pages)","Nested folders are the canonical way Stream Deck users overcome the 6/15/32-key limit. Without it, AKP153 effectively has 15 actions ceiling.","Add a `FolderAction` to the action engine; profile schema gains a recursive `pages` array. Render breadcrumb + back key in `ProfileEditor.qml`.","M","P0","[Stream Deck folders](https://www.elgato.com/us/en/explorer/products/stream-deck/how-to-use-folders-stream-deck/)"
"E. Stream Deck specific","Animated GIF / MP4 key icons","Elgato Stream Deck (animated icons, marketplace icon packs), StreamController (background images & videos)","Animated icons are how creators give the device personality (recording-pulse, live-on-air spinner). Currently only static JPEG/PNG is supported in AKP backends.","Decode GIF/APNG/MP4 frames in `src/devices/streamdeck/akp*.cpp` (use Qt's QMovie or FFmpeg) and tick a per-key animation timer in the device thread; respect the AKP image codec (JPEG 85x85 / PNG 72x72).","M","P1","[Animated icons via Stream Deck](https://www.reddit.com/r/elgato/comments/1qs43z7/i_updated_my_free_stream_deck_compatible_key/); [StreamController background videos](https://flathub.org/en/apps/com.core447.StreamController)"
"E. Stream Deck specific","Encoder / dial actions (rotate left/right, push, with on-screen labels)","Elgato Stream Deck + (Multifunction Dials), Bitfocus Companion","AKP03/AKP05 hardware already has knobs but the action engine has no encoder-aware action type. The encoder panel is a stub.","Add `EncoderAction` (rotate-cw, rotate-ccw, press, long-press) to the action interface and bind in `EncoderPanel.qml`. The `akp03_protocol.hpp` and `akp05_protocol.hpp` already report these events.","S","P0","[Stream Deck + technical specs](https://help.elgato.com/hc/en-us/articles/10567379685901-Elgato-Stream-Deck-Technical-Specifications); [Companion encoders](https://bitfocus.io/companion)"
"E. Stream Deck specific","Stream Deck + touch-strip widgets (sliders, meters, indicators)","Elgato Stream Deck +, BetterTouchTool","AKP05 has a touch strip listed as a feature in `docs/protocols/streamdeck/akp05.md` but no UI; competitor apps render audio meters, transport bars, brightness sliders.","Define a `TouchStripWidget` set (slider, meter, label) in `src/core`; wire to AKP05 touch events in `akp05.cpp`. Render a config canvas in `EncoderPanel.qml`.","M","P1","[Stream Deck + touch strip](https://help.elgato.com/hc/en-us/articles/10567379685901-Elgato-Stream-Deck-Technical-Specifications); [BetterTouchTool touch screen](https://community.folivora.ai/t/stream-deck-plus-touchscreen/30041)"
"E. Stream Deck specific","Built-in clock / timer / weather tiles","Stream Deck (Time tile via plugin), StreamController (Display the current time)","Tiny utility tiles (clock, countdown) are popular and demonstrate the engine works. Trivial once VariableStore and dynamic titles exist.","Ship a first-party `clock` / `countdown` plugin under `python/ajazz_plugins/examples/` once dynamic titles land.","S","P2","[StreamController time plugin](https://flathub.org/en/apps/com.core447.StreamController)"
"E. Stream Deck specific","Iconography library / built-in key designer","Elgato Key Creator, OWN3D animated icons, Marketplace icon packs","Users want to make a button look right without opening Photoshop. A built-in designer drops the time-to-first-cool-key from minutes to seconds.","Add an in-app `IconDesigner.qml` (text + glyph + background colour + icon-pack picker). Bundle Iconify or Font Awesome free for offline glyphs.","M","P2","[Elgato Key Creator](https://www.elgato.com/us/en/s/keycreator)"
"F. Keyboard specific","Per-key remapping live (no flash, no reboot)","Vial, VIA, QMK, ASUS Armoury Crate (per-game)","Live remap is the entire reason users put up with a custom keyboard utility. The README claims VIA support but no QML editor surfaces it.","Add a `KeymapEditor.qml` over `via_keyboard.cpp`; for the proprietary backend, expose the `register.cpp` keymap commands behind the same UI.","M","P0","[Vial real-time remap](https://svalboard.substack.com/p/svalboard-now-with-real-time-keyboard); [VIA/Vial X-Bows guide](https://x-bows.com/blogs/engineering-innovation/definitive-guide-qmk-via-vial-xbows-keyboards)"
"F. Keyboard specific","Layers / Fn layer editor (QMK-style up to 4-16 layers)","Vial, VIA, QMK","Layers are the killer QMK feature — without an editor the project supports them in firmware but the user can't actually use them.","Reuse the `KeymapEditor.qml`, but key it on layer index. Persist as a list in profile schema; via_keyboard backend already supports it.","M","P1","[Vial layers](https://x-bows.com/blogs/engineering-innovation/definitive-guide-qmk-via-vial-xbows-keyboards)"
"F. Keyboard specific","Polling-rate / debounce / N-key rollover toggles","Razer Synapse 4, Logitech G HUB, ASUS Armoury Crate, Vial (some boards)","Competitive players tune polling rate and debounce; without these knobs the keyboard tab feels under-featured.","Add capability flags in `core/capabilities.hpp` and surface sliders in `KeyDesigner.qml` -> Keyboard tab. Backend pushes via `proprietary_protocol.hpp`.","S","P1","[Synapse 4 features](https://www.razer.com/synapse-4); [G HUB polling](https://www.reddit.com/r/MouseReview/comments/1ban9b8/do_you_need_g_hub_to_be_open_to_use_4k_polling/)"
"F. Keyboard specific","Rapid Trigger / per-key actuation point (for magnetic / Hall-effect boards)","Razer Synapse 4 (Rapid Trigger), Wooting/Vial","Rapid Trigger is now the differentiating feature in the competitive keyboard space. ajazz keyboards may not all support it but the UI should expose it where the firmware does.","Behind a `HasMagneticSwitches` capability flag, add a `RapidTriggerSettings.qml` panel writing to the proprietary backend.","M","P2","[Synapse 4 Rapid Trigger](https://www.razer.com/synapse-4)"
"F. Keyboard specific","On-the-fly macro recording from a hardware shortcut","Corsair iCUE, Razer Synapse, Logitech G HUB","Lets users record a macro with the keyboard itself (FN + Record) without opening the GUI. Especially appreciated by gamers mid-session.","Reserve a hardware combo in `proprietary_keyboard.cpp` to push events into the existing `MacroRecorder` and persist on release.","S","P2","[iCUE macro record](https://www.corsair.com/us/en/explorer/gamer/keyboards/how-to-add-macros-and-remap-keys-in-corsair-icue/)"
"G. Mouse specific","DPI stage editor with up to 5 stages and per-stage colour","Razer Synapse 4, Logitech G HUB, Corsair iCUE, Piper","Already advertised on the AJ-series mice (PAW3395 sensor), but the README's `Features` only says 'DPI stages' without a UI tour. Stages + colour LED feedback are baseline.","Surface a `DpiStageEditor.qml` writing through `aj_series.cpp`. Bind LED colour per stage to existing RGB infrastructure.","S","P0","[Piper DPI](https://itsfoss.com/piper-configure-gaming-mouse-linux/); [G HUB DPI per game](https://www.youtube.com/watch?v=nLN5VWtvds4)"
"G. Mouse specific","Lift-off distance and surface calibration","Razer Synapse 4, Logitech G HUB (G PRO), Corsair iCUE","Critical for FPS players. PAW3395 supports it; the UI just needs a control.","Add `set_lift_off(uint8_t mm)` to the mouse driver in `src/devices/mouse/aj_series.cpp` (sensor command) and a slider in `MousePanel.qml`.","S","P1","[Synapse 4 features](https://www.razer.com/synapse-4)"
"G. Mouse specific","Sniper / on-press DPI shift button","Razer Synapse Hypershift, Logitech G HUB, Corsair iCUE","While-held DPI drop is universally implemented. Without it competitive shooters won't migrate.","Implement as a `HoldAction` (depends on tap/hold) toggling a temporary DPI override in `aj_series.cpp`.","S","P1","[Razer Hypershift](https://mysupport.razer.com/app/answers/detail/a_id/1789/~/how-to-activate-the-razer-hypershift-on-a-razer-mouse)"
"G. Mouse specific","Angle snapping / acceleration toggle","Razer Synapse 4, Corsair iCUE, Logitech G HUB","Tournament-legal mouse setup requires turning these off; UI must expose a switch.","Pass-through to PAW3395/PAW3950 register write in `aj_series.cpp`; one switch in `MousePanel.qml`.","S","P2","[Synapse 4](https://www.razer.com/synapse-4)"
"G. Mouse specific","Per-app mouse profile (DPI / button map per game)","Logitech G HUB, Razer Synapse 4, Corsair iCUE","Same as profile auto-switch (C) but specific to mice — most users want the mouse to know which game they're in.","Falls out of profile auto-switching once profiles can scope to a device subset.","S","P0","[G HUB per-game profile](https://www.youtube.com/watch?v=nLN5VWtvds4); [iCUE per-game profile](https://www.corsair.com/us/en/explorer/diy-builder/how-tos/how-to-create-an-icue-profile-for-your-favorite-game/)"
"H. System integration","Local HTTP / WebSocket control API","Bitfocus Companion (HTTP/TCP/UDP/OSC/WebSocket), Stream Deck SDK (WebSocket internal)","Lets external automations (Touch Portal, scripts, dashboards) drive ajazz devices without a plugin. Differentiator vs vendor software.","Add an `HttpServer` module in `src/plugins` (Crow / cpp-httplib) exposing `/v1/devices/{id}/keys/{n}/press` and a `WebSocketServer` for streaming events.","M","P1","[Companion HTTP/WebSocket/OSC](https://bitfocus.io/companion)"
